,_id,Car_Name,OverAll_Rating,Price,Rating_Title,Reviews_Description,Review_Author,User_Rating,Review_Date
0,631cbd94162b49f160799774,Maruti Alto 800 tour ,4.8/5,Rs.3.91 - 3.97 Lakh,Maruti Alto 800 Tour Is Awesome Car,Maruti Alto 800 tour is an awesome car. Its price is very affordable. It's a very comfortable car.,epoch surfaces,5.0,"Jul 09, 2022"
1,631cbd96162b49f160799775,Maruti Alto 800 tour ,4.8/5,Rs.3.91 - 3.97 Lakh,Good Experience To Own Alto 800 Tour,It's a good experience to own Alto 800 tour car. Sitting is very good & comfortable. Overall the car is superb.,pankaj,5.0,"Jul 05, 2022"
2,631cbd97162b49f160799776,Maruti Alto 800 tour ,4.8/5,Rs.3.91 - 3.97 Lakh,Amazing Car,It's an amazing car for my family. The mileage is very good like a bike. Safety is good with amazing features. I think it's a good car for a family.,salimul hoque,4.5,"Jun 20, 2022"
3,631cbd97162b49f160799777,Maruti Alto 800 tour ,4.8/5,Rs.3.91 - 3.97 Lakh,Good Car For Small Family,"Zero maintenance car, best in mileage, Smooth and comfortable driving. ",ajay sharma,5.0,"May 24, 2022"
4,631cbd97162b49f160799778,Maruti Alto 800 tour ,4.8/5,Rs.3.91 - 3.97 Lakh,Good Car For The Middle- Class Family,"This is a nice car for middle-class families and this is the best car at its price segment. its comfort level is good, it comes with good features and the mileage is also good.",mushtaque raza,4.5,"Apr 18, 2022"
5,631cbd97162b49f160799779,Maruti Alto 800 tour ,4.8/5,Rs.3.91 - 3.97 Lakh,Good Mileage,It's a good car on a low budget with good mileage.  It's good for middle-class families. I am using it for the office gives great mileage.,manish,4.0,"Apr 16, 2022"
